{
  "$schema": "https://json-schema.org/draft/2020-12/schema",
  "$id": "https://lape26.org/schemas/pilot-stimulus.schema.json",
  "title": "LAPE-26 Pilot Stimulus Fixture",
  "type": "object",
  "required": ["artifactId", "artifactVersion", "seed", "coreSet", "orthographicChallengeSet", "interpretationBoundary", "representativenessBoundary", "provenance"],
  "$defs": {
    "provenanceBlock": {
      "type": "object",
      "required": [
        "normalization_profile_id", "normalization_status", "normalization_spec_path",
        "normalization_implementation", "normalization_live_sha256",
        "normalization_committed_blob_sha", "pipeline_source_commit", "working_tree_dirty",
        "source_tree_digest", "input_data_sha256"
      ],
      "additionalProperties": false,
      "properties": {
        "normalization_profile_id": { "const": "lape-text-normalization-v0.1" },
        "normalization_status": { "const": "provisional-frozen" },
        "normalization_spec_path": { "const": "specs/text-normalization.md" },
        "normalization_implementation": { "const": "python/lape26/normalize.py" },
        "normalization_live_sha256": { "type": "string", "pattern": "^[0-9a-f]{64}$" },
        "normalization_committed_blob_sha": { "type": "string", "pattern": "^[0-9a-f]{40}$" },
        "pipeline_source_commit": { "type": "string", "pattern": "^[0-9a-f]{40}$" },
        "working_tree_dirty": { "type": "boolean" },
        "source_tree_digest": { "type": "string", "pattern": "^[0-9a-f]{64}$" },
        "input_data_sha256": { "type": "string", "pattern": "^[0-9a-f]{64}$" }
      }
    }
  },
  "properties": {
    "artifactId": { "const": "pilot-stimulus-v0.1" },
    "artifactVersion": { "type": "string" },
    "seed": { "type": "integer" },
    "coreSet": {
      "type": "array",
      "minItems": 108,
      "maxItems": 108,
      "uniqueItems": true,
      "items": {
        "type": "object",
        "required": ["word", "length", "lengthBand", "polarity", "vaderCompound", "partOfSpeech", "sourceDataset"],
        "additionalProperties": false,
        "properties": {
          "word": { "type": "string" },
          "length": { "type": "integer" },
          "lengthBand": { "enum": ["short", "medium", "long"] },
          "polarity": { "enum": ["positive", "negative", "neutral"] },
          "vaderCompound": { "type": "number" },
          "partOfSpeech": { "type": "string" },
          "sourceDataset": { "type": "string" }
        }
      }
    },
    "orthographicChallengeSet": {
      "type": "array",
      "minItems": 12,
      "maxItems": 12,
      "uniqueItems": true,
      "items": {
        "type": "object",
        "required": ["word", "category"],
        "additionalProperties": false,
        "properties": {
          "word": { "type": "string" },
          "category": { "enum": ["repeated-letters", "rare-letters", "vowel-heavy", "consonant-heavy"] }
        }
      }
    },
    "interpretationBoundary": { "type": "string" },
    "representativenessBoundary": { "type": "string" },
    "provenance": { "$ref": "#/$defs/provenanceBlock" }
  },
  "additionalProperties": false
}
