{
  "artifactId": "pilot-stimulus-v0.1",
  "artifactVersion": "0.1.0",
  "coreSet": [
    {
      "length": 5,
      "lengthBand": "short",
      "partOfSpeech": "verb",
      "polarity": "positive",
      "sourceDataset": "opinion-lexicon+vader-confirmed",
      "vaderCompound": 0.5574,
      "word": "ADORE"
    },
    {
      "length": 4,
      "lengthBand": "short",
      "partOfSpeech": "noun",
      "polarity": "positive",
      "sourceDataset": "opinion-lexicon+vader-confirmed",
      "vaderCompound": 0.3182,
      "word": "CALM"
    },
    {
      "length": 5,
      "lengthBand": "short",
      "partOfSpeech": "noun",
      "polarity": "positive",
      "sourceDataset": "opinion-lexicon+vader-confirmed",
      "vaderCompound": 0.4019,
      "word": "CHARM"
    },
    {
      "length": 4,
      "lengthBand": "short",
      "partOfSpeech": "noun",
      "polarity": "positive",
      "sourceDataset": "opinion-lexicon+vader-confirmed",
      "vaderCompound": 0.3182,
      "word": "COOL"
    },
    {
      "length": 4,
      "lengthBand": "short",
      "partOfSpeech": "adjective",
      "polarity": "positive",
      "sourceDataset": "opinion-lexicon+vader-confirmed",
      "vaderCompound": 0.4404,
      "word": "EASY"
    },
    {
      "length": 5,
      "lengthBand": "short",
      "partOfSpeech": "verb",
      "polarity": "positive",
      "sourceDataset": "opinion-lexicon+vader-confirmed",
      "vaderCompound": 0.4588,
      "word": "EXCEL"
    },
    {
      "length": 5,
      "lengthBand": "short",
      "partOfSpeech": "noun",
      "polarity": "positive",
      "sourceDataset": "opinion-lexicon+vader-confirmed",
      "vaderCompound": 0.4019,
      "word": "FAVOR"
    },
    {
      "length": 5,
      "lengthBand": "short",
      "partOfSpeech": "verb",
      "polarity": "positive",
      "sourceDataset": "opinion-lexicon+vader-confirmed",
      "vaderCompound": 0.4019,
      "word": "FREED"
    },
    {
      "length": 4,
      "lengthBand": "short",
      "partOfSpeech": "adjective",
      "polarity": "positive",
      "sourceDataset": "opinion-lexicon+vader-confirmed",
      "vaderCompound": 0.4588,
      "word": "NEAT"
    },
    {
      "length": 5,
      "lengthBand": "short",
      "partOfSpeech": "adjective",
      "polarity": "positive",
      "sourceDataset": "opinion-lexicon+vader-confirmed",
      "vaderCompound": 0.4019,
      "word": "NIFTY"
    },
    {
      "length": 5,
      "lengthBand": "short",
      "partOfSpeech": "adjective",
      "polarity": "positive",
      "sourceDataset": "opinion-lexicon+vader-confirmed",
      "vaderCompound": 0.4588,
      "word": "SUAVE"
    },
    {
      "length": 4,
      "lengthBand": "short",
      "partOfSpeech": "verb",
      "polarity": "positive",
      "sourceDataset": "opinion-lexicon+vader-confirmed",
      "vaderCompound": 0.2263,
      "word": "WARM"
    },
    {
      "length": 5,
      "lengthBand": "short",
      "partOfSpeech": "noun",
      "polarity": "negative",
      "sourceDataset": "opinion-lexicon+vader-confirmed",
      "vaderCompound": -0.4215,
      "word": "AGONY"
    },
    {
      "length": 5,
      "lengthBand": "short",
      "partOfSpeech": "adverb",
      "polarity": "negative",
      "sourceDataset": "opinion-lexicon+vader-confirmed",
      "vaderCompound": -0.4767,
      "word": "BADLY"
    },
    {
      "length": 5,
      "lengthBand": "short",
      "partOfSpeech": "verb",
      "polarity": "negative",
      "sourceDataset": "opinion-lexicon+vader-confirmed",
      "vaderCompound": -0.4215,
      "word": "BROKE"
    },
    {
      "length": 4,
      "lengthBand": "short",
      "partOfSpeech": "noun",
      "polarity": "negative",
      "sourceDataset": "opinion-lexicon+vader-confirmed",
      "vaderCompound": -0.34,
      "word": "DIRT"
    },
    {
      "length": 5,
      "lengthBand": "short",
      "partOfSpeech": "verb",
      "polarity": "negative",
      "sourceDataset": "opinion-lexicon+vader-confirmed",
      "vaderCompound": -0.4404,
      "word": "EXPEL"
    },
    {
      "length": 5,
      "lengthBand": "short",
      "partOfSpeech": "adverb",
      "polarity": "negative",
      "sourceDataset": "opinion-lexicon+vader-confirmed",
      "vaderCompound": -0.4019,
      "word": "MADLY"
    },
    {
      "length": 5,
      "lengthBand": "short",
      "partOfSpeech": "adjective",
      "polarity": "negative",
      "sourceDataset": "opinion-lexicon+vader-confirmed",
      "vaderCompound": -0.3612,
      "word": "MESSY"
    },
    {
      "length": 5,
      "lengthBand": "short",
      "partOfSpeech": "adjective",
      "polarity": "negative",
      "sourceDataset": "opinion-lexicon+vader-confirmed",
      "vaderCompound": -0.1779,
      "word": "NOISY"
    },
    {
      "length": 5,
      "lengthBand": "short",
      "partOfSpeech": "adverb",
      "polarity": "negative",
      "sourceDataset": "opinion-lexicon+vader-confirmed",
      "vaderCompound": -0.4215,
      "word": "SADLY"
    },
    {
      "length": 4,
      "lengthBand": "short",
      "partOfSpeech": "adjective",
      "polarity": "negative",
      "sourceDataset": "opinion-lexicon+vader-confirmed",
      "vaderCompound": -0.4215,
      "word": "VAIN"
    },
    {
      "length": 5,
      "lengthBand": "short",
      "partOfSpeech": "verb",
      "polarity": "negative",
      "sourceDataset": "opinion-lexicon+vader-confirmed",
      "vaderCompound": -0.2732,
      "word": "WEARY"
    },
    {
      "length": 5,
      "lengthBand": "short",
      "partOfSpeech": "noun",
      "polarity": "negative",
      "sourceDataset": "opinion-lexicon+vader-confirmed",
      "vaderCompound": -0.4767,
      "word": "WORSE"
    },
    {
      "length": 5,
      "lengthBand": "short",
      "partOfSpeech": "verb",
      "polarity": "neutral",
      "sourceDataset": "words+wordnet+vader",
      "vaderCompound": 0.0,
      "word": "ALLOT"
    },
    {
      "length": 5,
      "lengthBand": "short",
      "partOfSpeech": "adverb",
      "polarity": "neutral",
      "sourceDataset": "words+wordnet+vader",
      "vaderCompound": 0.0,
      "word": "APACE"
    },
    {
      "length": 4,
      "lengthBand": "short",
      "partOfSpeech": "noun",
      "polarity": "neutral",
      "sourceDataset": "words+wordnet+vader",
      "vaderCompound": 0.0,
      "word": "BRAE"
    },
    {
      "length": 5,
      "lengthBand": "short",
      "partOfSpeech": "noun",
      "polarity": "neutral",
      "sourceDataset": "words+wordnet+vader",
      "vaderCompound": 0.0,
      "word": "EBONY"
    },
    {
      "length": 4,
      "lengthBand": "short",
      "partOfSpeech": "verb",
      "polarity": "neutral",
      "sourceDataset": "words+wordnet+vader",
      "vaderCompound": 0.0,
      "word": "FLAY"
    },
    {
      "length": 5,
      "lengthBand": "short",
      "partOfSpeech": "noun",
      "polarity": "neutral",
      "sourceDataset": "words+wordnet+vader",
      "vaderCompound": 0.0,
      "word": "FUSEE"
    },
    {
      "length": 5,
      "lengthBand": "short",
      "partOfSpeech": "adverb",
      "polarity": "neutral",
      "sourceDataset": "words+wordnet+vader",
      "vaderCompound": 0.0,
      "word": "INFRA"
    },
    {
      "length": 5,
      "lengthBand": "short",
      "partOfSpeech": "adjective",
      "polarity": "neutral",
      "sourceDataset": "words+wordnet+vader",
      "vaderCompound": 0.0,
      "word": "LEAFY"
    },
    {
      "length": 5,
      "lengthBand": "short",
      "partOfSpeech": "verb",
      "polarity": "neutral",
      "sourceDataset": "words+wordnet+vader",
      "vaderCompound": 0.0,
      "word": "MERGE"
    },
    {
      "length": 5,
      "lengthBand": "short",
      "partOfSpeech": "adjective",
      "polarity": "neutral",
      "sourceDataset": "words+wordnet+vader",
      "vaderCompound": 0.0,
      "word": "MUSKY"
    },
    {
      "length": 5,
      "lengthBand": "short",
      "partOfSpeech": "adjective",
      "polarity": "neutral",
      "sourceDataset": "words+wordnet+vader",
      "vaderCompound": 0.0,
      "word": "SEAMY"
    },
    {
      "length": 5,
      "lengthBand": "short",
      "partOfSpeech": "adverb",
      "polarity": "neutral",
      "sourceDataset": "words+wordnet+vader",
      "vaderCompound": 0.0,
      "word": "TWICE"
    },
    {
      "length": 7,
      "lengthBand": "medium",
      "partOfSpeech": "verb",
      "polarity": "positive",
      "sourceDataset": "opinion-lexicon+vader-confirmed",
      "vaderCompound": 0.4588,
      "word": "APPLAUD"
    },
    {
      "length": 7,
      "lengthBand": "medium",
      "partOfSpeech": "noun",
      "polarity": "positive",
      "sourceDataset": "opinion-lexicon+vader-confirmed",
      "vaderCompound": 0.4939,
      "word": "BRAVERY"
    },
    {
      "length": 7,
      "lengthBand": "medium",
      "partOfSpeech": "adjective",
      "polarity": "positive",
      "sourceDataset": "opinion-lexicon+vader-confirmed",
      "vaderCompound": 0.3818,
      "word": "CAPABLE"
    },
    {
      "length": 8,
      "lengthBand": "medium",
      "partOfSpeech": "adjective",
      "polarity": "positive",
      "sourceDataset": "opinion-lexicon+vader-confirmed",
      "vaderCompound": 0.3182,
      "word": "DESIROUS"
    },
    {
      "length": 7,
      "lengthBand": "medium",
      "partOfSpeech": "verb",
      "polarity": "positive",
      "sourceDataset": "opinion-lexicon+vader-confirmed",
      "vaderCompound": 0.3818,
      "word": "ENTHUSE"
    },
    {
      "length": 6,
      "lengthBand": "medium",
      "partOfSpeech": "adjective",
      "polarity": "positive",
      "sourceDataset": "opinion-lexicon+vader-confirmed",
      "vaderCompound": 0.128,
      "word": "FERVID"
    },
    {
      "length": 6,
      "lengthBand": "medium",
      "partOfSpeech": "adverb",
      "polarity": "positive",
      "sourceDataset": "opinion-lexicon+vader-confirmed",
      "vaderCompound": 0.25,
      "word": "KEENLY"
    },
    {
      "length": 8,